{
  "$schema": "http://json-schema.org/draft-07/schema#",
  "$id": "urn:pulso:v3:evidence:1",
  "title": "Pulso v3 evidence",
  "type": "object",
  "additionalProperties": false,
  "properties": {
    "id": {
      "type": "string",
      "pattern": "^[A-Za-z0-9][A-Za-z0-9_-]{0,79}$"
    },
    "kind": {
      "enum": [
        "executed",
        "manual",
        "static",
        "not_run"
      ]
    },
    "status": {
      "enum": [
        "pass",
        "fail",
        "blocked",
        "not_run"
      ]
    },
    "checkedAt": {
      "type": "string",
      "format": "date-time"
    },
    "criterionIds": {
      "type": "array",
      "items": {
        "type": "string",
        "pattern": "^[A-Za-z0-9][A-Za-z0-9_-]{0,79}$"
      },
      "minItems": 0
    },
    "taskIds": {
      "type": "array",
      "items": {
        "type": "string",
        "pattern": "^[A-Za-z0-9][A-Za-z0-9_-]{0,79}$"
      },
      "minItems": 0
    },
    "report": {
      "type": "string",
      "minLength": 1,
      "pattern": "^(?!/)(?!.*\\\\)(?!.*(?:^|/)\\.\\.(?:/|$))(?![A-Za-z]:)[^\\u0000]+$"
    },
    "command": {
      "anyOf": [
        {
          "type": "string",
          "minLength": 1
        },
        {
          "type": "null"
        }
      ]
    },
    "cwd": {
      "type": "string",
      "minLength": 1,
      "pattern": "^(?!/)(?!.*\\\\)(?!.*(?:^|/)\\.\\.(?:/|$))(?![A-Za-z]:)[^\\u0000]+$"
    },
    "exitCode": {
      "anyOf": [
        {
          "type": "integer"
        },
        {
          "type": "null"
        }
      ]
    },
    "basis": {
      "type": "string",
      "minLength": 1
    },
    "files": {
      "type": "array",
      "items": {
        "type": "object",
        "additionalProperties": false,
        "properties": {
          "path": {
            "type": "string",
            "minLength": 1,
            "pattern": "^(?!/)(?!.*\\\\)(?!.*(?:^|/)\\.\\.(?:/|$))(?![A-Za-z]:)[^\\u0000]+$"
          },
          "sha256": {
            "type": "string",
            "pattern": "^[a-f0-9]{64}$"
          }
        },
        "required": [
          "path",
          "sha256"
        ]
      },
      "minItems": 1
    },
    "summary": {
      "type": "string",
      "minLength": 1
    }
  },
  "required": [
    "id",
    "kind",
    "status",
    "checkedAt",
    "criterionIds",
    "taskIds",
    "report",
    "command",
    "cwd",
    "exitCode",
    "basis",
    "files",
    "summary"
  ]
}
